{
  "schema_version": "IIOS-COMPANY-SOURCE-CAPTURE-PLAN-0.1",
  "case_id": "RC-CN-A-300750-20261004",
  "market": "CN-A",
  "symbol": "300750",
  "company": "宁德时代",
  "cutoff_date": "2026-10-04T23:59:59+08:00",
  "purpose": "B2-B real evidence acquisition prerequisites; this plan does not admit any Evidence Record.",
  "capture_requirements": [
    {
      "capture_id": "CATL-B2B-001",
      "field_groups": ["security_identity","business_reality","financial_reality"],
      "source_ref": "CNINFO:DISCLOSURE",
      "source_locator": "https://static.cninfo.com.cn/finalpage/2026-07-24/1225442062.PDF",
      "pit_basis": "SOURCE_VINTAGE",
      "required": true,
      "exact_bytes_required": true,
      "status": "PENDING_RAW",
      "notes": "2026 H1 annual report; physical source capture and hash recomputation are still required."
    },
    {
      "capture_id": "CATL-B2B-002",
      "field_groups": ["corporate_disclosures","trust_governance_events"],
      "source_ref": "CNINFO:DISCLOSURE",
      "source_locator": "https://static.cninfo.com.cn/finalpage/2026-10-01/1225592063.PDF",
      "pit_basis": "EVENT_PUBLICATION",
      "required": true,
      "exact_bytes_required": true,
      "status": "PENDING_RAW",
      "notes": "2026-09-30 board-approved related-party guarantee disclosure published 2026-10-01."
    },
    {
      "capture_id": "CATL-B2B-003",
      "field_groups": ["capital_structure"],
      "source_ref": "CNINFO:DISCLOSURE",
      "source_locator": "https://static.cninfo.com.cn/finalpage/2026-04-30/1225274804.PDF",
      "pit_basis": "EVENT_PUBLICATION",
      "required": true,
      "exact_bytes_required": true,
      "status": "PENDING_RAW",
      "notes": "2026-04-30 H-share placement completion and post-issue share count."
    },
    {
      "capture_id": "CATL-B2B-004",
      "field_groups": ["capital_structure","trust_governance_events"],
      "source_ref": "CNINFO:DISCLOSURE",
      "source_locator": "https://static.cninfo.com.cn/finalpage/2026-08-07/1225465154.PDF",
      "pit_basis": "EVENT_PUBLICATION",
      "required": true,
      "exact_bytes_required": true,
      "status": "PENDING_RAW",
      "notes": "2026-08-07 top-ten shareholder disclosure connected to the buyback plan."
    },
    {
      "capture_id": "CATL-B2B-005",
      "field_groups": ["market_price"],
      "source_ref": "SZSE:MARKET_DATA",
      "source_locator": "SZSE official market-data lookup; code=300750; trade_date=2026-09-30",
      "pit_basis": "TRADE_DATE",
      "required": true,
      "exact_bytes_required": true,
      "status": "PENDING_RAW",
      "notes": "Official historical quote capture is required for the 2026-09-30 close. Secondary dynamic webpages are not canonical PIT evidence."
    }
  ],
  "plan_status": "BLOCKED_PENDING_RAW",
  "audit": {
    "plan_sha256": "56ad26fb672ad038a5656add0444b315e85bee95803db2e18c826910b7a6a721"
  }
}
